,Author(s),Title,Publication Date,Source,Page Numbers,Link,Category,Abstract,Countries,heatwave,heat wave,heat  wave,heat  action  plan,heat  health,heat early warning system,heat-health action plan,heat-health warning  systems,extreme heat management,heat wave management,public health heat wave alert
2,"PA Stott, DA Stone, MR Allen - Nature, 2004 - nature.com",Human contribution to the European heatwave of 2003,"PA Stott, DA Stone, MR Allen - Nature, 2004 - nature.com","PA Stott, DA Stone, MR Allen - Nature, 2004 - nature.com",[PDF] grandkidzfuture.com,https://www.nature.com/articles/nature03089,Academic Journal,"… It is an ill-posed question whether the 2003 heatwave was … the risk of the occurrence of such 
a heatwave 6 , 7 , 8 . Here we … the risk of a heatwave exceeding this threshold magnitude. …","Austria, China, Colombia, Germany, France, India, Italy, Japan, Laos, Mali",1.0,1.0,0.0,0.0,0.0,0.0,0.0,0.0,0.0,0.0,0.0
4,"SE Perkins-Kirkpatrick, PB Gibson - Scientific Reports, 2017 - nature.com",Changes in regional heatwave characteristics as a function of increasing global temperature,"SE Perkins-Kirkpatrick, PB Gibson - Scientific Reports, 2017 - nature.com","SE Perkins-Kirkpatrick, PB Gibson - Scientific Reports, 2017 - nature.com",[HTML] nature.com,https://www.nature.com/articles/s41598-017-12520-2,Academic Journal,"… up to 120 extra heatwave days/season if 5 C is reached. Increases in heatwave intensity are 
… Between warming thresholds of 1.5 C and 2.5 C, the return intervals of intense heatwaves …","Australia, Chile, China, United Kingdom, India, Italy, Japan, Mali, Russia, United States, South Africa",1.0,1.0,0.0,0.0,0.0,0.0,0.0,0.0,0.0,0.0,0.0
6,"JR Nairn, RJB Fawcett - … journal of environmental research and public …, 2015 - mdpi.com",The excess heat factor: a metric for heatwave intensity and its use in classifying heatwave severity,"JR Nairn, RJB Fawcett - … journal of environmental research and public …, 2015 - mdpi.com","JR Nairn, RJB Fawcett - … journal of environmental research and public …, 2015 - mdpi.com",[PDF] mdpi.com,https://www.mdpi.com/1660-4601/12/1/227,Academic Journal,"… heatwaves threaten. Analysis and forecasts of low-intensity heatwaves would also be 
included in a heatwave … Measurement and tracking of more frequent low-intensity heatwaves …","Australia, Switzerland, China, France, Georgia, Cambodia, Mali, Oman, Sweden, United States",1.0,1.0,0.0,0.0,0.0,0.0,0.0,0.0,0.0,0.0,0.0
7,"SE Perkins-Kirkpatrick, SC Lewis - Nature communications, 2020 - nature.com",Increasing trends in regional heatwaves,"SE Perkins-Kirkpatrick, SC Lewis - Nature communications, 2020 - nature.com","SE Perkins-Kirkpatrick, SC Lewis - Nature communications, 2020 - nature.com",[HTML] nature.comFull View,https://www.nature.com/articles/s41467-020-16970-7,Academic Journal,"… temperature dataset and key heatwave metrics, we systematically examine regional and 
global observed heatwave trends. In almost all regions, heatwave frequency demonstrates the …","Australia, Brazil, Canada, Switzerland, China, United Kingdom, Greenland, Indonesia, India, Iceland, Italy, Japan, Mali, Russia, United States",1.0,1.0,0.0,0.0,0.0,0.0,0.0,0.0,0.0,0.0,0.0
9,"MA Coleman, AJP Minne, S Vranken, T Wernberg - Scientific reports, 2020 - nature.com",Genetic tropicalisation following a marine heatwave,"MA Coleman, AJP Minne, S Vranken, T Wernberg - Scientific reports, 2020 - nature.com","MA Coleman, AJP Minne, S Vranken, T Wernberg - Scientific reports, 2020 - nature.com",[HTML] nature.com,https://www.nature.com/articles/s41598-020-69665-w,Academic Journal,"… -occurring seaweeds within the footprint of the heatwave that opened space for rapid local 
… the footprint of the heatwave. Thus, extreme events such as marine heatwaves not only lead …","Australia, Chile, China, Cuba, Denmark, India, Italy, Japan, Mali, Oman",1.0,1.0,0.0,0.0,0.0,0.0,0.0,0.0,0.0,0.0,0.0
11,"KE Smoyer-Tomic, R Kuhn, A Hudson - Natural hazards, 2003 - Springer",Heat wave hazards: an overview of heat wave impacts in Canada,"KE Smoyer-Tomic, R Kuhn, A Hudson - Natural hazards, 2003 - Springer","KE Smoyer-Tomic, R Kuhn, A Hudson - Natural hazards, 2003 - Springer",Save Cite Cited by 244 Related articles All 13 versions  ,https://link.springer.com/article/10.1023/A:1022946528157,Academic Journal,"… in defining heat waves and harmful hot weather events, followed by a spatial and historical 
overview of heat waves across Canada, and an assessment of heat wave adaptation …","Australia, Canada, Switzerland, Kenya, United States",0.0,1.0,0.0,0.0,0.0,0.0,0.0,0.0,0.0,0.0,0.0
13,"DD Joseph, L Preziosi - Reviews of modern physics, 1989 - APS",Heat waves,"DD Joseph, L Preziosi - Reviews of modern physics, 1989 - APS","DD Joseph, L Preziosi - Reviews of modern physics, 1989 - APS",[PDF] researchgate.net,https://journals.aps.org/rmp/abstract/10.1103/RevModPhys.61.41,Academic Journal,"The concept of transmission of heat by waves is reviewed and interpreted. The notion of an 
effective thermal conductivity, an effective heat capacity, and relaxation functions for heat and …","Canada, Italy, Japan, United States",0.0,1.0,0.0,0.0,0.0,0.0,0.0,0.0,0.0,0.0,0.0
15,"J Tan, Y Zheng, G Song, LS Kalkstein… - International journal of …, 2007 - Springer","Heat wave impacts on mortality in Shanghai, 1998 and 2003","J Tan, Y Zheng, G Song, LS Kalkstein… - International journal of …, 2007 - Springer","J Tan, Y Zheng, G Song, LS Kalkstein… - International journal of …, 2007 - Springer",[PDF] researchgate.net,https://link.springer.com/article/10.1007/s00484-006-0058-3,Academic Journal,"… , heat waves both in 1998 and in 2003 all led to elevated mortality in Shanghai, China. While 
the heat waves … two years’ heat waves, and to better understand how heat impacts human …","Austria, China, Germany, Japan, Kenya, Netherlands, Oman, United States",1.0,1.0,0.0,0.0,0.0,0.0,0.0,0.0,0.0,0.0,0.0
16,"PA Stott, DA Stone, MR Allen - Nature, 2004 - nature.com",Human contribution to the European heatwave of 2003,"PA Stott, DA Stone, MR Allen - Nature, 2004 - nature.com","PA Stott, DA Stone, MR Allen - Nature, 2004 - nature.com",[PDF] grandkidzfuture.com,https://www.nature.com/articles/nature03089,Academic Journal,"… We may have underestimated the FAR of a heatwave in 2003 by … Given the effects of the 
2003 heatwave, this suggests a … The 2003 heat wave in Europe: A shape of things to come? …","Austria, China, Colombia, Germany, France, India, Italy, Japan, Laos, Mali",1.0,1.0,0.0,0.0,0.0,0.0,0.0,0.0,0.0,0.0,0.0
21,"KE Smoyer-Tomic, R Kuhn, A Hudson - Natural hazards, 2003 - Springer",Heat wave hazards: an overview of heat wave impacts in Canada,"KE Smoyer-Tomic, R Kuhn, A Hudson - Natural hazards, 2003 - Springer","KE Smoyer-Tomic, R Kuhn, A Hudson - Natural hazards, 2003 - Springer",Save Cite Cited by 244 Related articles All 13 versions  ,https://link.springer.com/article/10.1023/A:1022946528157,Academic Journal,"… in defining heat waves and harmful hot weather events, followed by a spatial and historical 
overview of heat waves across Canada, and an assessment of heat wave adaptation …","Australia, Canada, Switzerland, Kenya, United States",0.0,1.0,0.0,0.0,0.0,0.0,0.0,0.0,0.0,0.0,0.0
23,"DD Joseph, L Preziosi - Reviews of modern physics, 1989 - APS",Heat waves,"DD Joseph, L Preziosi - Reviews of modern physics, 1989 - APS","DD Joseph, L Preziosi - Reviews of modern physics, 1989 - APS",[PDF] researchgate.net,https://journals.aps.org/rmp/abstract/10.1103/RevModPhys.61.41,Academic Journal,"The concept of transmission of heat by waves is reviewed and interpreted. The notion of an 
effective thermal conductivity, an effective heat capacity, and relaxation functions for heat and …","Canada, Italy, Japan, United States",0.0,1.0,0.0,0.0,0.0,0.0,0.0,0.0,0.0,0.0,0.0
25,"J Tan, Y Zheng, G Song, LS Kalkstein… - International journal of …, 2007 - Springer","Heat wave impacts on mortality in Shanghai, 1998 and 2003","J Tan, Y Zheng, G Song, LS Kalkstein… - International journal of …, 2007 - Springer","J Tan, Y Zheng, G Song, LS Kalkstein… - International journal of …, 2007 - Springer",[PDF] researchgate.net,https://link.springer.com/article/10.1007/s00484-006-0058-3,Academic Journal,"… , heat waves both in 1998 and in 2003 all led to elevated mortality in Shanghai, China. While 
the heat waves … two years’ heat waves, and to better understand how heat impacts human …","Austria, China, Germany, Japan, Kenya, Netherlands, Oman, United States",1.0,1.0,0.0,0.0,0.0,0.0,0.0,0.0,0.0,0.0,0.0
26,"PA Stott, DA Stone, MR Allen - Nature, 2004 - nature.com",Human contribution to the European heatwave of 2003,"PA Stott, DA Stone, MR Allen - Nature, 2004 - nature.com","PA Stott, DA Stone, MR Allen - Nature, 2004 - nature.com",[PDF] grandkidzfuture.com,https://www.nature.com/articles/nature03089,Academic Journal,"… We may have underestimated the FAR of a heatwave in 2003 by … Given the effects of the 
2003 heatwave, this suggests a … The 2003 heat wave in Europe: A shape of things to come? …","Austria, China, Colombia, Germany, France, India, Italy, Japan, Laos, Mali",1.0,1.0,0.0,0.0,0.0,0.0,0.0,0.0,0.0,0.0,0.0
30,"IJ Dwyer, SJE Barry, I Megiddo, CJ White - International journal of …, 2022 - Springer",Evaluations of heat action plans for reducing the health impacts of extreme heat: methodological developments (2012–2021) and remaining challenges,"IJ Dwyer, SJE Barry, I Megiddo, CJ White - International journal of …, 2022 - Springer","IJ Dwyer, SJE Barry, I Megiddo, CJ White - International journal of …, 2022 - Springer",[HTML] springer.com,https://link.springer.com/article/10.1007/s00484-022-02326-x,Academic Journal,"… In this study, we collated evaluations of heat-health action plans that assessed their 
effectiveness in reducing the adverse health outcomes of hot weather extremes. We examined 11 …","Australia, Canada, Switzerland, China, Spain, France, United Kingdom, Greenland, India, Iran, Italy, Mali, New Zealand, Portugal",1.0,1.0,0.0,0.0,0.0,0.0,1.0,0.0,0.0,0.0,0.0
31,"JJ Hess, S Lm, K Knowlton, S Saha, P Dutta… - … of environmental and …, 2018 - hindawi.com",Building resilience to climate change: pilot evaluation of the impact of India's first heat action plan on all-cause mortality,"JJ Hess, S Lm, K Knowlton, S Saha, P Dutta… - … of environmental and …, 2018 - hindawi.com","JJ Hess, S Lm, K Knowlton, S Saha, P Dutta… - … of environmental and …, 2018 - hindawi.com",[HTML] hindawi.com,https://www.hindawi.com/journals/jeph/2018/7973519/abs/,Academic Journal,"… In low- and middle-income countries, there are very few heat action plans and there is a lack 
of … Our results indicate that that heat action plans may be effective in protecting vulnerable …","Switzerland, Germany, France, Greenland, Hong Kong, India, Italy, United States",1.0,1.0,0.0,0.0,0.0,1.0,1.0,0.0,0.0,0.0,0.0
36,"…, Ahmedabad Heat and Climate Study Group - International journal of …, 2014 - mdpi.com","Development and implementation of South Asia's first heat-health action plan in Ahmedabad (Gujarat, India)","…, Ahmedabad Heat and Climate Study Group - International journal of …, 2014 - mdpi.com","…, Ahmedabad Heat and Climate Study Group - International journal of …, 2014 - mdpi.com",[HTML] mdpi.com,https://www.mdpi.com/1660-4601/11/4/3473,Academic Journal,"… effort include a Heat Action Plan (HAP), and an extreme heat early warning … Heat Action 
Plan The HAP was developed as an administrative tool that would define different levels of heat …","Bangladesh, Brazil, Canada, Switzerland, China, Georgia, India, Oman, Pakistan, United States",1.0,1.0,0.0,0.0,0.0,1.0,1.0,0.0,0.0,0.0,0.0
40,"A Casanueva, A Burgstall, S Kotlarski… - … and public health, 2019 - mdpi.com",Overview of existing heat-health warning systems in Europe,"A Casanueva, A Burgstall, S Kotlarski… - … and public health, 2019 - mdpi.com","A Casanueva, A Burgstall, S Kotlarski… - … and public health, 2019 - mdpi.com",[PDF] mdpi.com,https://www.mdpi.com/1660-4601/16/15/2657,Academic Journal,"… European heat-health warning systems and heat-health action … heat-health warning systems, 
such as the one currently under development in the framework of the Horizon 2020 HEAT-…","Austria, Australia, Belgium, Belarus, Canada, Switzerland, Germany, Denmark, Spain, France, Georgia, Greece, Hong Kong, Hungary, India, Italy, North Macedonia, Niger, Netherlands, Oman, Peru, Portugal, Romania, Sweden, Slovenia, United States",1.0,1.0,0.0,0.0,0.0,0.0,1.0,0.0,0.0,0.0,0.0
41,"M Loughnan, N Nicholls… - International Journal of …, 2012 - downloads.hindawi.com",Mapping heat health risks in urban areas,"M Loughnan, N Nicholls… - International Journal of …, 2012 - downloads.hindawi.com","M Loughnan, N Nicholls… - International Journal of …, 2012 - downloads.hindawi.com",[PDF] hindawi.com,https://downloads.hindawi.com/archive/2012/518687.pdf,Academic Journal,"… , demographic, and health-related risk factors for heat stress. The spatial variations in … 
heat-related health outcomes in urban Melbourne. The index was weighted using measured health …","Cuba, Iraq, Japan, Togo",0.0,0.0,0.0,0.0,0.0,0.0,0.0,0.0,0.0,0.0,0.0
44,"J Tan, LS Kalkstein, J Huang, S Lin, H Yin… - International Journal of …, 2004 - Springer",An operational heat/health warning system in Shanghai,"J Tan, LS Kalkstein, J Huang, S Lin, H Yin… - International Journal of …, 2004 - Springer","J Tan, LS Kalkstein, J Huang, S Lin, H Yin… - International Journal of …, 2004 - Springer",[PDF] udel.edu,https://link.springer.com/article/10.1007/s00484-003-0193-z,Academic Journal,"… areas, and it is our belief that an operational heat/health watch/warning system can be used 
to save lives and lessen the negative impact of heat waves. The watch/warning systems are …","Switzerland, China, Japan, Kenya",0.0,1.0,0.0,0.0,0.0,0.0,0.0,0.0,0.0,0.0,0.0
45,"M Pascal, K Laaidi, M Ledrans, E Baffert… - International journal of …, 2006 - Springer",France's heat health watch warning system,"M Pascal, K Laaidi, M Ledrans, E Baffert… - International journal of …, 2006 - Springer","M Pascal, K Laaidi, M Ledrans, E Baffert… - International journal of …, 2006 - Springer",[PDF] academia.edu,https://link.springer.com/article/10.1007/s00484-005-0003-x,Academic Journal,"… exhaustion with dehydration to severe heat strokes and death. Heat strokes can occur 
less than … The lag time between heat exposure and indirect health effects depends on pre-existing …","Belgium, Spain, Finland, France, Jordan, Kenya",1.0,1.0,0.0,0.0,0.0,0.0,0.0,0.0,0.0,0.0,0.0
46,"CJ Tomlinson, L Chapman… - … of health …, 2011 - ij-healthgeographics.biomedcentral …","Including the urban heat island in spatial heat health risk assessment strategies: a case study for Birmingham, UK","CJ Tomlinson, L Chapman… - … of health …, 2011 - ij-healthgeographics.biomedcentral …","CJ Tomlinson, L Chapman… - … of health …, 2011 - ij-healthgeographics.biomedcentral …",[HTML] biomedcentral.com,https://ij-healthgeographics.biomedcentral.com/articles/10.1186/1476-072X-10-42,Academic Journal,"… techniques [40, 41] has allowed the spatial extent of the UHI to be measured at a higher 
resolution than previously, and this paper focuses on using this data for heat health risk studies. …","Australia, Brazil, Canada, Switzerland, Chile, China, Spain, France, United Kingdom, Greece, Italy, Japan, Mexico, Netherlands, Peru, Portugal, United States",1.0,1.0,0.0,0.0,0.0,0.0,0.0,0.0,0.0,0.0,0.0
54,"A Casanueva, A Burgstall, S Kotlarski… - International journal of …, 2019 - mdpi.com",Overview of existing heat-health warning systems in Europe,"A Casanueva, A Burgstall, S Kotlarski… - International journal of …, 2019 - mdpi.com","A Casanueva, A Burgstall, S Kotlarski… - International journal of …, 2019 - mdpi.com",[PDF] mdpi.com,https://www.mdpi.com/1660-4601/16/15/2657,Academic Journal,"… , describes the heat early warning and heat action for … early warning system and inter-agency 
coordination, (3) capacity building among health care professionals and (4) reducing heat …","Austria, Australia, Belgium, Belarus, Canada, Switzerland, Germany, Denmark, Spain, France, Georgia, Greece, Hong Kong, Hungary, India, Italy, North Macedonia, Niger, Netherlands, Oman, Peru, Portugal, Romania, Sweden, Slovenia, United States",1.0,1.0,0.0,0.0,0.0,0.0,1.0,0.0,0.0,0.0,0.0
58,"A Matzarakis, G Laschewski, S Muthers - Atmosphere, 2020 - mdpi.com",The heat health warning system in Germany—Application and warnings for 2005 to 2019,"A Matzarakis, G Laschewski, S Muthers - Atmosphere, 2020 - mdpi.com","A Matzarakis, G Laschewski, S Muthers - Atmosphere, 2020 - mdpi.com",[PDF] mdpi.com,https://www.mdpi.com/2073-4433/11/2/170,Academic Journal,"… of an advanced procedure known as a “heat health warning system” (HHWS). It is aimed at 
… heat health warning systems as a consequence of the 2003 heat waves. Specific periods of …","Austria, Belgium, Switzerland, Germany, Spain, France, Georgia, Greece, Hungary, Italy, North Macedonia, Mali, Netherlands, Oman, Poland, Portugal, Romania, Sweden, Slovenia",0.0,1.0,0.0,0.0,0.0,0.0,0.0,0.0,0.0,0.0,0.0
59,"R Lowe, M García-Díez, J Ballester, J Creswick… - International journal of …, 2016 - mdpi.com",Evaluation of an early-warning system for heat wave-related mortality in Europe: Implications for sub-seasonal to seasonal forecasting and climate services,"R Lowe, M García-Díez, J Ballester, J Creswick… - International journal of …, 2016 - mdpi.com","R Lowe, M García-Díez, J Ballester, J Creswick… - International journal of …, 2016 - mdpi.com",[PDF] mdpi.com,https://www.mdpi.com/1660-4601/13/2/206,Academic Journal,"… climate-resilient health systems. A HHAP relies on early-warning systems for timely activation 
… These results are promising for the development of more localised early warning systems. …","Switzerland, China, Germany, Denmark, Spain, France, United Kingdom, Georgia, India, Italy, Mali, Niger, Oman, Slovenia, Chad, Taiwan, United States",1.0,1.0,0.0,0.0,0.0,0.0,1.0,0.0,0.0,0.0,0.0
63,"K Knowlton, SP Kulkarni, GS Azhar… - International journal of …, 2014 - mdpi.com","Development and implementation of South Asia's first heat-health action plan in Ahmedabad (Gujarat, India)","K Knowlton, SP Kulkarni, GS Azhar… - International journal of …, 2014 - mdpi.com","K Knowlton, SP Kulkarni, GS Azhar… - International journal of …, 2014 - mdpi.com",[HTML] mdpi.com,https://www.mdpi.com/1660-4601/11/4/3473,Academic Journal,"… heat action plan for Ahmedabad. Its specific objectives were: (1) to assess heat-health impacts 
… project, offer details on the first heat-health action plan implemented in a South Asian city, …","Bangladesh, Brazil, Canada, Switzerland, China, Georgia, India, Oman, Pakistan, United States",1.0,1.0,0.0,0.0,0.0,1.0,1.0,0.0,0.0,0.0,0.0
65,"MS Ragettli, M Röösli - Bundesgesundheitsblatt-Gesundheitsforschung …, 2019 - Springer",Heat-health action plans to prevent heat-related deaths—experiences from Switzerland,"MS Ragettli, M Röösli - Bundesgesundheitsblatt-Gesundheitsforschung …, 2019 - Springer","MS Ragettli, M Röösli - Bundesgesundheitsblatt-Gesundheitsforschung …, 2019 - Springer",Save Cite Cited by 5 Related articles All 5 versions  ,https://link.springer.com/article/10.1007/s00103-019-02928-8,Academic Journal,"… of Ticino have developed heat-health action plans. Such plans integrate and coordinate 
the … Analyses show that heat-health action plans have contributed to the prevention of heat-…","Switzerland, Kenya",1.0,1.0,0.0,0.0,0.0,0.0,1.0,0.0,0.0,0.0,0.0
66,"A Casanueva, A Burgstall, S Kotlarski… - International journal of …, 2019 - mdpi.com",Overview of existing heat-health warning systems in Europe,"A Casanueva, A Burgstall, S Kotlarski… - International journal of …, 2019 - mdpi.com","A Casanueva, A Burgstall, S Kotlarski… - International journal of …, 2019 - mdpi.com",[PDF] mdpi.com,https://www.mdpi.com/1660-4601/16/15/2657,Academic Journal,"… Here we present a state-of-the-art review of HHWSs and heat-health action plans (HHAPs) 
of 16 countries, based on existing literature, web research and direct contact to National …","Austria, Australia, Belgium, Belarus, Canada, Switzerland, Germany, Denmark, Spain, France, Georgia, Greece, Hong Kong, Hungary, India, Italy, North Macedonia, Niger, Netherlands, Oman, Peru, Portugal, Romania, Sweden, Slovenia, United States",1.0,1.0,0.0,0.0,0.0,0.0,1.0,0.0,0.0,0.0,0.0
67,"HC Ho, K Lau, C Ren, D Wang - Environmental Science and Pollution …, 2022 - Springer",Systematic identification of heat events associated with emergency admissions to enhance the heat-health action plan in a subtropical city: a data-driven approach,"HC Ho, K Lau, C Ren, D Wang - Environmental Science and Pollution …, 2022 - Springer","HC Ho, K Lau, C Ren, D Wang - Environmental Science and Pollution …, 2022 - Springer",[PDF] cuhk.edu.hk,https://link.springer.com/article/10.1007/s11356-022-21963-8,Academic Journal,"… Reduction (UNDRR), a heat-health action plan should address various impacts of hazards 
… ) in Hong Kong in order to enhance the heat-health action plan. Immediate, short-term, and …","Australia, Canada, Switzerland, China, Spain, France, United Kingdom, Hong Kong, Japan, Kenya, Malaysia, Sweden, Thailand",1.0,1.0,0.0,0.0,0.0,0.0,1.0,0.0,1.0,0.0,0.0
68,"HC Çulpan, Ü Şahin, G Can - Atmosphere, 2022 - mdpi.com",A Step to Develop Heat-Health Action Plan: Assessing Heat Waves' Impacts on Mortality,"HC Çulpan, Ü Şahin, G Can - Atmosphere, 2022 - mdpi.com","HC Çulpan, Ü Şahin, G Can - Atmosphere, 2022 - mdpi.com",[HTML] mdpi.com,https://www.mdpi.com/2073-4433/13/12/2126,Academic Journal,"… the implementation of Heat-Health Action Plans, which … the health system, and improvements 
in urban planning [15]. … Therefore, there is a need for local and national action plans …","Australia, Canada, Switzerland, Denmark, Spain, France, Georgia, India, Iran, Mali, Oman, Pakistan, Turkey, United States",1.0,1.0,0.0,0.0,0.0,0.0,1.0,0.0,0.0,0.0,0.0
69,"M Pascal, K Laaidi, M Ledrans, E Baffert… - International journal of …, 2006 - Springer",France's heat health watch warning system,"M Pascal, K Laaidi, M Ledrans, E Baffert… - International journal of …, 2006 - Springer","M Pascal, K Laaidi, M Ledrans, E Baffert… - International journal of …, 2006 - Springer",[PDF] academia.edu,https://link.springer.com/article/10.1007/s00484-005-0003-x,Academic Journal,"… A national action plan was set up, using this watch warning … by the set up of an Action Plan 
in Marseille, after the 1983 event, … that the activation of the action plan is not totally unjustified. …","Belgium, Spain, Finland, France, Jordan, Kenya",1.0,1.0,0.0,0.0,0.0,0.0,0.0,0.0,0.0,0.0,0.0
70,"A Casanueva, A Burgstall, S Kotlarski… - International journal of …, 2019 - mdpi.com",Overview of existing heat-health warning systems in Europe,"A Casanueva, A Burgstall, S Kotlarski… - International journal of …, 2019 - mdpi.com","A Casanueva, A Burgstall, S Kotlarski… - International journal of …, 2019 - mdpi.com",[PDF] mdpi.com,https://www.mdpi.com/1660-4601/16/15/2657,Academic Journal,"… development of heat-health warning systems and action plans … of 16 European heat-health 
warning systems and heat-health … the way for future heat-health warning systems, such as the …","Austria, Australia, Belgium, Belarus, Canada, Switzerland, Germany, Denmark, Spain, France, Georgia, Greece, Hong Kong, Hungary, India, Italy, North Macedonia, Niger, Netherlands, Oman, Peru, Portugal, Romania, Sweden, Slovenia, United States",1.0,1.0,0.0,0.0,0.0,0.0,1.0,0.0,0.0,0.0,0.0
71,"J Tan, LS Kalkstein, J Huang, S Lin, H Yin… - International Journal of …, 2004 - Springer",An operational heat/health warning system in Shanghai,"J Tan, LS Kalkstein, J Huang, S Lin, H Yin… - International Journal of …, 2004 - Springer","J Tan, LS Kalkstein, J Huang, S Lin, H Yin… - International Journal of …, 2004 - Springer",[PDF] udel.edu,https://link.springer.com/article/10.1007/s00484-003-0193-z,Academic Journal,"… it is our belief that an operational heat/health watch/warning system can be used to save 
lives and lessen the negative impact of heat waves. The watch/warning systems are based on a …","Switzerland, China, Japan, Kenya",0.0,1.0,0.0,0.0,0.0,0.0,0.0,0.0,0.0,0.0,0.0
73,"A Matzarakis, G Laschewski, S Muthers - Atmosphere, 2020 - mdpi.com",The heat health warning system in Germany—Application and warnings for 2005 to 2019,"A Matzarakis, G Laschewski, S Muthers - Atmosphere, 2020 - mdpi.com","A Matzarakis, G Laschewski, S Muthers - Atmosphere, 2020 - mdpi.com",[PDF] mdpi.com,https://www.mdpi.com/2073-4433/11/2/170,Academic Journal,"… and warned by means of an advanced procedure known as a “heat health warning system 
(… European countries have implemented heat health warning systems as a consequence of …","Austria, Belgium, Switzerland, Germany, Spain, France, Georgia, Greece, Hungary, Italy, North Macedonia, Mali, Netherlands, Oman, Poland, Portugal, Romania, Sweden, Slovenia",0.0,1.0,0.0,0.0,0.0,0.0,0.0,0.0,0.0,0.0,0.0
